{
  "module": {
    "name": "urf-demo-module",
    "version": "v0.0.1",
    "interfaces": {
      "imports": [
        "urf-spine"
      ],
      "exports": [
        "demo:hello"
      ]
    },
    "invariants": [
      "deterministic-replay",
      "sha256-artifact-hashes",
      "snf-artifact-sorting",
      "merkle-root-over-(path,sha256)"
    ]
  },
  "spine": {
    "version": "v1.1.0",
    "environment": {
      "oci_image_digest": "sha256:REPLACE_ME"
    },
    "manifest": {
      "ordering": "lex(path)",
      "merkle_root_sha256": "REPLACE_ME"
    }
  },
  "evidence": {
    "artifacts": [
      {
        "path": "artifacts/module_instance/hello.txt",
        "sha256": "f154089fd1cce3d98649754f45f236a820473829f79a7028cfc86c7b9339c6d2"
      },
      {
        "path": "artifacts/module_instance/hello2.txt",
        "sha256": "c86d8f950a34c69156313f12408df33429fe64f1ae52070abe3e080a62d2182e"
      },
      {
        "path": "artifacts/module_instance/hello3.txt",
        "sha256": "REPLACE_ME"
      },
      {
        "path": "artifacts/module_instance/hello3.txt",
        "sha256": "9614e70221e9a1463c24e7b88bec04de9baa87b2337668d2e64c7f52ec41ac04"
      }
    ]
  },
  "hashes": {
    "certificate_sha256": ""
  }
}
